I've been in hell with no escape.	I'm just in constant pain. The entire time. Iron rods shooting through my shins, stepping on sharp rocks, needles being pushed into my shoulder joint, the bones in my calf deep freezing in an instant. Not always all at once. Often one at a time. And there are periods when I have none... That almost makes it worse. Makes me realize how bad it has slowly become. How much I've been fighting to maintain a normal life. A life where I go to class, and out with friends. A life where I don't wince every 5 minutes, or control my breathing to stop tears forming in my eyes. I'm tired all the time. I just want a nap. Just 5 years should do it. The meds my doctor's gave me all stop working over time, and I don't know if it's because the pains are getting worse, or my body's getting used to the drugs, or a combination of both. But I do know that the drugs they're trying me on are several categories above where I started a year ago. My GP hasn't a clue what's causing it, or who to refer me to. The rhumatologist was the same. I'm not sure I'll survive another 7 months on a waiting list. Not with all of me intact. Even typing this I have pains in my thumb, my ankle, my collarbone, through my lungs, and my hands are twitching randomly. It makes it hard, when I'm going through all this, while still dealing with the ongoing grief from my brothers cancer journey, and his death. And so desperately wishing it's not cancer. And I feel like I can't say anything, because despite the length I have no label. I can't say I have... Anything. Because we have no idea. We're not even sure it's a nerve disorder. It may be psychological. And I feel like crap even mentioning it, because it's nothing compared to what my little brother went through with his chemo, and coming to terms with his mortality and death. So I suck it up, and bury it deep, but I'm scared. Terrified. What if life's like this now? What if there's never an answer? What if the damage is already done? If you've made it this far, I'm sorry it's so long. Just had a lot of very confusing things to get out.	undiagnosed
I can’t write certain letters and numbers	I have this problem where I cannot write certain letters. It is kind of hard to explain, but I am going to do my best. I didn’t notice it until a few years ago. I went to write the letter “S” and my mind just froze. My pen was to the paper, getting ready to write my name, and I just couldn’t make my hand move. I kept starting over and over to write the “S” and I finally got it, but it was messy looking. Growing up I do not recall having any problems with writing letters. I have always done well in my English classes, and I love to read, and journaling used to be a big thing for me. I have never been diagnosed with a learning disorder either. I don’t think it’s a learning disorder, and I’ll explain why. If I am not looking down at the paper, or if I close my eyes, I can write the letters that I have trouble with while writing a word. The letters(and numbers) that give me the most trouble are: S, O, P, Q, D, C, G, J, O, Q, S, and U. Sometimes the letters V, J, and W. With the “W” I have noticed I have problems when I try to use curved lines instead of straight ones to make the W. The numbers are: 2, 3, 8, 9, 0. When I look at the numbers and letters I have a hard time writing, they all seem to be curved in one way or another. Making letters out of straight lines are fine. I will be writing a sentence, or a word, and when I come to a difficult letter my hand stops, and I have to force my hand to make the movement to finish the letter/number. This is while writing words, and sentences, etc. If I am making the letters by themselves I don’t typically have a problem. I feel my hand tense up whenever I start to write, and I sometimes get cramps from holding my pen too tight while trying to write. I can write a letter or number in the air, mimicking the way it would be written on paper, but when it comes time to it, I struggle. I also have no problems typing or reading. Here’s a little about me: I do struggle with dysthymia, general anxiety disorder, and PTSD. I am on antidepressants (I noticed this problem before the antidepressants). I get told a lot that I am tense, and I just recently had to go to the dentist because of a toothache, but nothing was wrong with my tooth, I was just clenching my jaw too tight, and putting a lot of pressure on my teeth. I clench my jaw when I am stressed, and I am constantly stressed. I do have a lot going on in my life, but even when things seem somewhat calm, I am stressed about something. I get told a lot I’m going to worry myself to death, which at this point I believe because I also suffer from GERD, and digestive health has been linked with stress. I do smoke weed, and socially drink (maybe a couple of times a month). I do smoke regularly. I didn’t start smoking until I was 21 (I’m 23 now) and I didn’t start drinking until I was 21 as well. I noticed this problem before I started smoking. I have found a couple of ways of going around these problems. For example for the letter 3, I have found it not a problem to start the number if I put a straight line at the top, and then finish the rest. I just started a new job where writing is a huge part of it, and I am becoming more and more frustrated with myself over this, and I don’t know what it means, or what to do about it. I do not have health insurance, so no I have not seen a doctor/neurologist about this. I am looking desperately for answers, and I keep coming up short. So if anyone knows anything about this, or experiences this, please share your knowledge. I cry about this frequently, and just want to fix it.	undiagnosed
What Is Wrong With My Foot?	So my right foot, just inbetween the ankel and the bottom of my foot, will hurt severely. To the point i have to limp around, cant bend it, or put weight on it. It'll even be sore to the touch right below my ankel. This happens if i wear high heels, use it to much ( walk long distances). Or sometimes it just happens randomly. Nothing i do ever relives the pain. No ibprufien. Not a hot bath. Not staying off of it or elavating it. Ive had xrays done but they show nothing. Bloodwork shows slightly high inflammation but nothing alarming. Ive been to my GP and a rumutolgist ( or however you spell it) and they have no answers for me. Does anybody have any idea what could be wrong? This has been going on since i was 15 and im 24 now.	undiagnosed
Not being taken seriously	I’ve talked about this in another subreddit but here we go. For over a year I’ve had lots of swollen lymph nodes and horrible constant lung pain. I went to the doctor multiple times but I just gave up after a while because I was told that I just had a cold and that it would go away. It did not. Around five months ago I started to get really bad joint and muscle pain all over. I went to the doctor a few times and got x-rays on my legs and lots of blood tests but everything came out fine. Soon after that, I developed chronic stomachaches and headaches that do not go away. I went to the doctor again but nothing came of it. After that I started to experience trouble balancing and tremors in my hands. I went to the doctor AGAIN today but she just told me she didn’t know what was happening and sent me home. Everything is extremely painful and it stops me from being able to hang out with people and doing things that I love. No one will listen to me or take me seriously and I just want to know what is happening so I can make it stop. (Sorry for any spelling or grammar mistakes I’m exhausted so I can’t focus well)	undiagnosed
i’m so frustrated	for almost exactly a year i’ve been experiencing frequent vomiting, frequent dizziness, constant fatigue, nausea, and headaches, and i’m so weak that sometimes i can’t walk or even sit up. i’ve been to many doctors and specialists, had a gastric emptying study done, an upper endoscopy, xrays, mris, ct scans, everything. and we can’t figure out what is going on with me. i’ve struggled with anxiety my whole life and i can tell it’s not anxiety. i recently turned 20, i used to travel to different countries, i had lots of friends and was always doing something fun and exciting. now i can barely leave my home unless it’s to go to work. i’m so young and it’s so frustrating that these are supposed to be the best years of my life and i’m stuck here, quite literally suffering. i’m not asking any questions or looking for advice, just looking to vent to people who may understand.	undiagnosed
Depresssion or something else ?	Hi everyone, Recently (the last 4-5 months) I have been feeling quite down. And iv had so many symptoms. Before this I thought I knew my body, but it turns out I’m beginning to completely not understand myself. Il just get straight to it and try to create a cohesive pattern of events and maybe someone would have ideas or know what’s going on with me. So I had a really stressful time in my life (I think), at a work placement, I was doing work from 9-5 then doing more work at home after, trying to secure a job. However I didn’t quite click with the people and I felt they didn’t like me much, eventually we kept arguing and they would go out of their way to make things difficult for me. So I left. Now I usually have a lay back attitude yes these people annoyed me, yes it wasn’t a good part of my life, but I learned a lot and just chalked it up to them being not very nice people and that’s that. I didn’t feel stressed, during it. I got over it fast. Then I started to do small bits of work from home for myself and learn more. Things were great ! I was actually glad I left, I kept up with my new routine. But then one day I just felt a wave of depression come over me, but I wasn’t feeling sad or angry but I couldn’t shake the feeling. I did more exercise eat healthier all to try to lift the mood change I noticed. Well this kept going for on for a couple month and I was getting fed up. Then my symptoms took a nose dive. I began to feel extreme fatigue, joint pain I mean I was so tired that I felt I never slept at all, then for about 2 weeks into the third month I kept getting insomnia (which has now gone). I’ve been getting spots on my face which were never there before. So I went to the doctors for a blood test, it came back that I was low in Phosphate and my vitamin D levels were borderline, and they put me on Phosphate Sandoz 500mg Phosphorus. I took that for about a week and I felt a bit better. However overtime the symptoms came back again. Decided to have another blood test and my phosphate was LOWER than before, so he gave me TONS of the stuff. But this time it didn’t help. So I went back desperate to fix the fatigue. Because it had for awhile now interfered with my life, I can’t even remember what feeling energised feels like. So iv stopped taking the phosphate as it’s not helped but every day I take 2000 UI of Vitamin D. (Because vitamin D is harmless, I think) but nothing seems to change. I wake up in the morning feeling exhausted, my back and shoulders feel tense and stiff, and it’s the worst in the morning. Eventually through out the day it kind of simmers down, but then I’m left with a constant anxious feeling. But I have NOTHING to feel anxious about ! it’s just there ! My doctor chalked it up to Fibromyalgia (which I don’t believe) but also that it could be depression (which I’m starting to convince myself it is) but the thing is I don’t feel sad, I feel miserable because of how I feel everyday, not the other way around. Yes my life was rough for a bit but iv been through far worse, but im very fortunate and I have great supportive family and friends. However what iv also noticed accompany my fatigue is constant gut discomfort, and I struggle to go to the toilet very often. The doctor also noticed I had a nasal polyp. Which brings me to the other part of my puzzle, could vaping cause this nasal congestion and be ruining my life ? iv vaped for years and had no problem prior and I only vape 100% VG and nicotine on a low dose, no flavouring. I’m also hoping it isn’t vaping as I will struggle to quit it. I don’t want to go back to actual smoking. I just have so much wrong with me, which makes me down. I’m so confused. Does any of this hit a note with anyone ? or am I just depressed, without knowing it ? If anyone wants any more info ask questions I would be so thankful ! Any bit of knowledge in any of these areas could potentially improve my quality of life :)	undiagnosed
Dealing with being undiagnosed	I know so many of us have different issues, but I was wondering how you deal with being undiagnosed. Personally, I often feel unheard and like I’m making a big deal out of nothing, even when I’ve had it confirmed by doctors that there is a problem, we just don’t know what it is. What are your tips on living without a diagnosis, and not feeling hopeless?	undiagnosed
Fibromyalgia or Hypothyroid	I have severe insomnia. 4 months now. Cannot fall and stay asleep. Go days without sleeping. Sleeping pills work a few days then quit working. I had palpation when taking sleeping pills hr went from 65 to 150 in nothing flat. When I have palpitations hard to breathe. Has not done that since. I have Rheumatoid so I had bad joint pain. I had chest pain like burning of the rib cages a month before the insomnia. Back and neck pain. Before the insomnia I was sleeping 9 hours and felt unrefreshed. I have muscle spasm and myoclonus. Tingling and pain in the hands and feet. When I do not sleep burning all over. Been told the abnormal lab value was a high calcium which I has started taking a supplement 2 weeks prior and a low TSH but not enough to send me to an endocrine doctor.	undiagnosed
Undiagnosed for five years in Zimbabwe - please help!	Hi everyone. I’m writing to you from Zimbabwe, which if you’ve never heard of it, is a small African country just above South Africa and next to Mozambique. I’m looking for some advice about my mom – she’s had medical issues for the past five years or so and remains undiagnosed, but her symptoms seem to fit Addison’s Disease. This will probably be a pretty long post, but I really appreciate anyone who takes the time to read through it all, as I’m really desperate at this point. I just want to give you a little bit of background, as there may be severe emotional issues at play as well. My mom is 46, female, white, 5’4”, and about 130lbs. She was adopted at birth by a lovely couple who could not have children, and had a relatively happy childhood, although trauma may have been experienced as she grew up in the Rhodesian War. Her adopted dad passed away when she was 24 of a heart attack, and her adopted mom is still alive, but has Alzheimer’s. She lives in the UK and lost all of her savings when the Zimbabwean dollar crashed in 2008. My mom has told me that she was molested as a young child by another child that her parents has been thinking of adopting, although they never did. She was also raped in 2013 by an ex-boyfriend. She went through a string of bad relationships between 2010 to 2016, jumping from one to another. None were physically abusive, although I think there was some emotional abuse in some of them. She’s a single mother to myself and my younger sister and has no family here for support – financial or emotional. She was diagnosed with depression in 2013, and has suffered with it her whole life. She thinks that it’s related to her adoption. I’m now 23, but I was 17 and in my final year of high school when she first started exhibiting symptoms. My sister was 14. I dropped out of high school to work and support her, and also had to fund her medical costs, so there are some tests that were not run due to costs, although we did manage to do 99%. Cost is still a factor now, due to the hyperinflation currently occurring in Zimbabwe. She also lives in a town about 4 hours away from me. Okay so now the symptoms. In August 2014, whilst working an extremely high pressure and stress job, she exhibited the following: • Extreme anxiety and panic attacks • Insomnia • Alternating diarrhoea and constipation • Low blood pressure She was then diagnosed with bi-polar disorder, IBS, and a mental breakdown. She was prescribed Lithium, Amitriptyline, Bromazepam, and Piroxicam. After about two weeks, the symptoms seemed to subside, and she went back to work and life continued as per normal. Then, in February 2015, the symptoms reappeared, as well as some new ones. She was still working at the same job. Her full list of symptoms then were: • Extreme anxiety and panic attacks • Insomnia • Alternating diarrhoea and constipation • Low blood pressure • Tremor in her arms, most noticeable when trying to perform a task that requires control, such as buttoning a shirt • She walked with a strange gait, slightly bend over and shuffling. • Pigmentation on her face • Fatigue, even after getting a good night’s sleep • Excessive thirst, she would drink about 4 – 5 litres of water per day • A tingling sensation in her shins and calves when they were exposed to warmth – for example if she sat out in the sun, or if she was in a hot bath. She said it felt similar to pins and needles. • Brain fog and short-term memory loss. She wouldn’t remember conversation had the previous day, or if she’d left a pot on the stove. She was frequently confused during conversations. • Inability to regulate body temperature. She would be freezing cold and covered in goosebumps when it was warm, and put her jersey on, then get really hot and take it off again after 5 minutes, then get cold again. • Emotional. She would be crying all the time for no reason. Once after being at the shops, she accidently walked past our car in the parking lot, and then started crying because of it. • Body aches. Her body was aching constantly, mostly a 3 or 4 out of 10, but no pain medicines helped. The doctor ran blood tests for liver function, cholesterol, blood sugars, diabetes, lithium, a full blood count, thyroid function, hormones, vitamins, serums, lithium levels and a morning cortisol test. Her cholesterol was slightly high, urea was borderline low, and her lithium was low. Her cortisol level was 156 nmol/L. She had a raised eosinophil count on the FBC. All other results were normal. My mother was then referred to an endocrinologist who re-ran all the tests and did a physical examination. He found the following: • Pigmentation in her nail fold beds, creases on her palms, the skin of her face and neck, on all the sun exposed regions of her hands, feet, ankles, and arms, and on the surface of the buccal mucosa (the lining of the cheeks and the back of the lips inside the mouth where they touch the teeth) • Proximal muscle weakness in the legs • Postural hypotension, her BP dropping from 140/70 in the lying position to 115/20 in the sitting position • Nerve death in her lower legs, which was causing the tingling and the strange gait. • The repeat tests were normal – no elevated cortisol, blood ACTH level was normal, repeat FBC and thyroid functions, prolactin, liver functions – all normal. He then referred my mom to an endocrinology centre in South Africa, as he was at a loss as how to proceed. We travelled to Johannesburg and saw an endocrinologist there who was also at a loss. She conferred with her colleagues, and they suggested heavy metal poisoning. The blood tests for lead and arsenic disproved her theory, and the metals were 0 or too low to cause any effects. We returned home and then made an appointment with rheumatologist from the UK that was in the country for two months. He initially thought of lupus, but she was tested and did not have lupus. He then diagnosed her with Fibromyalgia. I was unhappy with this diagnosis, as was our GP as she said that my mom didn’t have the markers, so we then made an appointment with another endocrinologist. He had adbsolutely no theories at all and referred her to a psychiatrist. She saw the psychiatrist for two sessions, but she was so expensive that I couldn’t afford any more. Our GP then sent us to a neurologist and my mom had an MRI, which revealed no lesions at all. Amongst all of these tests, she’s also had various scans of her lungs, kidneys, EEGs, etc. Since then, she has been to several homeopaths and alternative medical professionals. One such person used headphones and electric current to find issues in the body. I’m afraid I can’t remember what the technique was, but she found only depression. Another homeopath used a ball that you squeeze, and it diagnoses you, but she also found nothing. She did prescribe my mom CBD oil for the pain, which she still takes, and it helps. But basically, that’s where we’re still at today. Some symptoms may be psychosomatic, but definitely not all of them, so it’s hard to rule out any symptoms as true or untrue. Just to summarise the conditions ruled out: Lupus, lung cancer, thyroid issues, diabetes, med side effects, heavy metal poisoning, kidney issues, brain tumour, fibromyalgia, vision issues, Celiac Disease. To anyone that made it all the way through – really thank you so much! I’m hoping someone can spot something I’ve missed.	undiagnosed
Frustrated and tired	This has been going on for a bit over ten years now and we still can't figure it out. I am a 24 yo female. I am in constant joint pain and can side from joint displacement. Basically my joints can dislocate and pop back into place with the wrong move. It isn't centralized in any address but it is worse in my knees, hips, ankles, and elbows. I am also hypermobile in all joints to the point where it causes extra pain. Some of my muscles are weaker than they should be, especially my hands. I have been tested for various arthritis disorders as well as various inflammation issues. All came up negative. I have been to physical therapy and although it helped somewhat, it didn't fix the issue. I am currently waiting to get an appointment with a genetics specialist to see if it is something there. I plan to ask about Ehlers Daniels Syndrome but is there anything else I should consider?	undiagnosed
Nausea is awful and stupid	It feels like my insides are doing a relay of deciding not to work. Sometimes swallowing doesn't make stuff go down. Sometimes my stomach takes forever to empty. Some times my small Intestine makes my belly feel like it's made of balloon animals. Sometimes my large intestine decides to not move for a week....and then evacuate everything in one day. I am very annoyed. I am so nauseous and my tum feels all burny and adrenaline-y. I don't know if that makes sense, but I just needed to vent. I dont feel well. Hxbdnsjksb. Tums didn't help. Pepto didnt help. Chewing on ginger helped a tiny bit... sigh. I'm trying to wait it out without taking gravol because it makes me sleepy (though it does help a bit) and I have to go to work soon.	undiagnosed
