Seeking Help with an Undiagnosed Illness (foreign objects that look like worms in throat, nose, etc.)	Hello, I'm looking for any sort of help or information that might lead to a diagnosis and cure for these symptoms I've been experiencing for over ten years. It started with a lump around 2006/2007 underneath my ear, then I started to get sick a lot. It was flu like symptoms and sever headaches, body aches, and dizziness. My equilibrium was so bad I felt like I'd fall over even when sitting down and it got so bad I'd be at work and feel like I'd pass out while sitting there (a feeling of being lightheaded but you're sitting down). Every time they did a needle biopsy where the knot was I'd break out with these big pustule cyst type bumps and I felt like something was crawling underneath my skin on the left side. They've done several needle biopsies since this began and eventually they took out my tonsils because they were getting swollen, bleeding, and full of puss. They took out my wisdom teeth because they said that could cause an infection in trying to pinpoint where this might be, but as a result my lymph nodes swelled up underneath the knot. After that they cut out 2 of my lymph nodes to do a biopsy and the results didn't show anything, and after more of them swelled back up. I've been wishing to see a infectious diseases doctor, but none of my primary care physicians have been willing to refer me. Just recently I lost my insurance, so now I really don't know what my options are. I've been doing research and watching documentaries about parasites and I've found that I have a lot of the same symptoms described by the people in these documentaries. I found an episode of Monsters Inside Me that describes the dirofilaria worm and this seems pretty close to my experience with whatever is going with me. However I'm not positive, I've found a few other illnesses that seem like they could fit such as Angiostongyliasis and toxoplasmosis, but I can't be sure. It feels like there's something moving around mostly in my eye and temple area and I've seen movement and an object that looks like a worm in my eye. Then objects that also look worm-like or like larvae have come out of my nose and throat and it feels like there's something rooting around in my sinuses at times, like something digging. This whole thing affects my speech at times to the point where I feel like I've had slurred speech. I'll be talking to people and it just comes out wrong. It's affecting my cognitive functions. When I'm talking to people it feels like I can't communicate properly and like everything just comes out wrong. Because I don't have insurance I've had to try alternate methods and medications. In my research I came across Dr Sebi's Cell Food (the Advanced Package), it comes with a product called Lymphalin and I've been using it because it's supposed to help with the lymph nodes swelling. Using the package has been offering some relief from the pain, but it's still there and still pretty active throughout the day. Please any help or advice is welcome. I just really want to understand what is going on inside of me and what steps I can take to move forward and find a cure. {These are pics of the object in my eye as well as some of the stuff that has come out of my nose/throat, might want to magnify so you can see it better. The eye pics are pretty blurry because it was moving around as I was taking the picture}: [https://postimg.cc/gallery/2dqz29zkk/](https://postimg.cc/gallery/2dqz29zkk/) [https://postimg.cc/gallery/2oq1w2mhg/](https://postimg.cc/gallery/2oq1w2mhg/)	undiagnosed
help me please	So, this is about something that started about 4-5 years ago. I started puking one day, it went away for a while at first. The doctors thought it was stomach acid but the medicine they gave me, didn't help. Eventually I started puking a couple times week, which then grew into puking like 20-30 times a day, literally. I have had countless hospitals and doctors visits and countless tests done. Nobody can seem to figure out why I puke so much but it effects me going to school and out in public. They gave me a pill to help calm the vomiting, that didn't work. They gave me a stronger one which works, but only for a certain time and I start puking again. Sometimes the pill doesn't work at all and I continue puking all day and night. It doesn't matter how much or how little I eat. It also doesn't matter what I eat. I wish it could just disappear and leave me alone but wishes don't work..I just want to be normal😭	undiagnosed
Please! Help is wlcome from anyone willing	My name is Sarah, I am 20 years old and for the past 6-8 momths I have been experiencing unbelievable abdominal pains. I have described these pains to multiple doctors and specialists. They are crippling, bring-me-to-my-knees types of pains, I become short of breath, start sweating profusely, and often cry from the pain (I am not an easy crier, I have a very high pain tolerance). In words I would describe it as someone using a pitchfork to spaghetti noodle my insides. It starts just below my belly button, spreads to my hips, then wrap around and come up my back and lasts anywhere from 15 minutes to an hour and a half, usually without any warning. After a CT scan, manual pelvic exam, internal pelvic ultrasoubd, multiple urine tests, a blood test, meeting with a uroligist and more, ALL of my tests have come back normal, with the exception of blood in my urine. I do have kidney stones and ovarian cysts, but have been told that neither of those is the cause of my pain. I am 5’4” and 160lbs at my heaviest — I have tried food journaling, changinging my diet, and losing weight. I am scheduled to meet with a GI specialist in 3 days, but I doubt that will give me any answers either. Please, though my boyfriend and family have been incredibly supportive, I am absolutely sick of dealing with this. I need answers, of any kind. I need you fellow redditors. Help me if you can...	undiagnosed
Undiagnosed neurological disorder	I made a post on ask doctors back in February about my current condition to see if they had any ideas. https://www.reddit.com/r/AskDocs/comments/b4fiwb/undiagnosed_illness_and_hoping_for_a_solution/?utm_source=share&utm_medium=ios_app&utm_name=iossmf My condition is still the same. No improvements at all. I am in the US and currently trying to get approved for SSI disability. I would honestly prefer to work. I just don’t know what type of job I would be able to do. I was wondering if anyone has the same symptoms? If so, what do you do for work?	undiagnosed
Scared of lymphoma	I’ve been crazy sick these past two months- nothing good has come from seeing doctors. My best lead now is that my lymph nodes have been swollen. I’m on antibiotics for ten days before they decide to do scans. Lymph nodes aren’t really shrinking but it’s only day three. Thoughts? And it’s lymph nodes on my neck and near my breasts	undiagnosed
Loved one has had undiagnosed very low ferritin levels for months with weakness and other symptoms	I've already posted much of what's below in another, non-reddit, forum, but they informed me that they weren't qualified to answer questions involving medical diagnoses, so I'm re-posting it here. \-------- I'm typing this on behalf of my mother. She has been feeling sick and weak for at least months and has gone to several doctors with no diagnosis. The problem is that the doctors don't communicate or share medical records, or, they are myopic and can't make diagnoses that fall outside their specialty. To get to the point, my mom's ferritin level has dropped from 9 to 7 in a month ( It's supposed to be in the 16 to 288 range for healthy individuals ). My mom's rheumatologist was concerned and sent her to hematologist who \*did nothing\*. He instead recommended that she should have a colonoscopy, but none of her other blood work or tests indicated that she had any type of gastrointestinal bleeding and she doesn't have dark stools . Since my mom saw her rheumatologist, my mom's ferritin dropped 2 more points. The sections of the blood work that are pertinent include the following : `Other blood results:` `IRON AND TOTAL IRON BINDING CAPACITY IRON, TOTAL Reference Range: 45-160 mcg/dL 67 - No Historical Data` `IRON BINDING CAPACITY Reference Range: 250-450 mcg/dL (calc) 468 H` `% SATURATION Reference Range: 16-45 % (calc) 14 L No Historical Data` `MCH 25.3 L Reference Range: 27.0-33.0 pg` `MCHC 30.6 L Reference Range: 32.0-36.0 g/dL` `RDW 16.4 H Reference Range: 11.0-15.0 %` We live in Spring Texas in the United States and my mom is using the government health care plan, which is horrible ( at least it is now, but it's all she can afford ). She's seen about a dozen or more doctors and none of them can seem to figure out what the problem is. We don't know quite what to do at this point. Anyway, I hope this is the correct forum for my question. If anyone has any recommendations, we'd be very grateful. Thank you, jdbtwo	undiagnosed
My Story	"My name is Brooke Journeaux. I am a 26 year old mother of two. I'll begin my story before I realized anything was wrong. I don't remember the exact date, but sometime in early 2017, I was walking through my kitchen when I experienced sharp, unbearable pain in both of my ears. My fiancé was able to direct me to the bed to sit down when I started to experience tingling sensations that went up both of my arms. And then it was like my brain shut off. I did not want to be touched. I curled up in fetal position and began to hysterically cry and hyperventilate. I don't really remember how long it lasted, an hour maybe, but when I woke up the next day I felt like I had a hangover. I had severe brain fog. We decided it best to go to the ER, where I was told I had a panic attack. I've had them before, but this was the worst one up to that point. Fast forward to late 2017. My girls and I had moved in with my parents down in Tennessee, while I worked at a bank as a single mother, getting our lives back together. It was stressful, but I was making it. In early 2018 I began to start having these strange sensations like I was always on the verge of having a panic attack. I would get hot flashes and cold chills and my brain would just feel foggy. I remember one day, while dealing with a customer, my computer screen just whirlpooled, for lack of a better word. I just brushed it off as nothing serious. Then there was the day I did have a panic attack at work and had to go sit in the break room while it passed. I was confused, because other than these recent weird feelings, I was the happiest I had been in a long time, so there should have been nothing causing me to have panic attacks. Then it got to the point where if I was stuck in traffic on the way home I would get dizzy and feel like I was going to pass out. I just figured I wasn't eating enough, even though I snacked between meals all day long. My fiancé moved back in with us April 2018 and the sensations would come and go, but I mostly felt fine and never felt the need to see a doctor about it. June of 2018 I noticed that I had lost most of the feeling in my right big toe. I thought it was weird, but it wasn't affecting me in any debilitating way, so I never got it looked at. July of 2018, I was involved in a hit run, in which the other person got away. I then had to spend the remainder of my savings account on buying a new car. A few weeks later I started to have battery issues with my new car, right before we had planned to take a week long vacation to go visit my family in South Carolina. I had to instead spend that money on getting my car fixed, so that was extremely stressful, as I hadn't seen my family there for several years. August 9, 2018. I went to my car on my lunch break. The last thing I ate were my blueberries and one of them had this awful chemical taste to it. I spit it out. I noticed that whenever I went back inside to work, the inside of my mouth had went numb on the left side. And the left side of my face began to feel weak. I went to answer the drive thru, which had feedback at times, that normally wouldn't bother me. This time it was extremely painful. I had hypersensitivity in my left ear and eye. I decided it best to go get checked out at an Urgent Care facility close to my home. He had me do a few things and concluded that my left side was weaker than my right and sent me to the ER. On the way there I began to get weird tingling sensations throughout my head. When I got there, they did an MRI, which came back inconclusive. I noticed that the pattern on my hospital gown made me dizzy. When I told them that, they blew it off and said they didn't know why that would be happening. I got sent home after they told me I had some sort of combination of Bell's Palsy and Trigeminal Neuralgia. They referred me for a follow up with a neurologist. I woke up the next day feeling completely fine. It wasn't until that evening that I had more issues. I was watching a movie with my girls. As soon as the movie went off and I went to move my head, everything went extremely blurry. I got extremely dizzy and my arms immediately started to tingle and go numb. I called my fiancé, who was at work at the time, completely freaking out and had him come home. It wasn't going away so we called an ambulance. They did a heart test, I forget what it's called. But it came back fine and they told me that it was the same thing I was dealing with the previous day and to schedule an appointment with a neurologist. The next few months were so crazy, that I'm not sure if this next part will be in chronological order. My memory is, and always has been awful. I talked to my supervisor about what was going on and went ahead and took my vacation hoping that by the time that week was up, I would be able to return to work. Well I wasn't. I was having almost constant dizziness as well as a lot of vertigo. I would get sharp pains and pressure behind my eyes and ears. Sometimes it would last only a few minutes, and others it would last for hours. A lot of the time I would have to just lay on the couch because I couldn't handle the amount of effort it took my brain to walk around. This eventually led to me being unable to drive or work. I saw a neurologist and he suspected Vestibular Migraines and put me on a week long round of steroids. This only made my symptoms more intense. Shortly after that I began to start having some of my weirder symptoms. Often it felt like I was trying to walk through water, as it seemed harder to move my legs. Sometimes they would just give out on me. I only fell all the way down once, and that was more due to vertigo. Here, I will list some of my symptoms: -vertigo, dizziness, lightheadedness, weakness, pain/pressure behind ears/eyes, numbness/tingling in random places, electric wave feelings going through my brain, confusion, trouble speaking when confused, a complete lack of thoughts at all, stabbing pains in random parts of my body, chest tightness, sore scalp, tinnitus, phantom noises, nystagmus, feeling of my brain being on fire, body swaying, heavy head, migraine, reduced hearing, leg stiffness, leg weakness, feeling of chest on fire, hot flashes, cold chills, heat made my dizziness and vertigo worse, while cold made my pain worse. These are just what I could think of off the top of my head. I can tell you that we tried a few different medications. The first one I tried was Amitriptyline, which didn't do anything but help me sleep, but I continued to take it for that reason. I didn't notice anything was wrong, but my fiancé noticed a change in my mood, where I was more irritable and more depressed. I had been taking it a little over a month, when I attempted suicide with my Amitriptyline. This was a rare side effect of this medication that almost killed me. I never in my right mind would do that to my family, regardless of what is going on with myself. So I discontinued the Amitriptyline and tried Nortriptyline, recommended by my ENT. I stopped taking it after the second day, as it made me absolutely miserable. It was as if my symptoms were magnified 10x. After that, I was done with medication for awhile and instead tried Vestibular Rehab. She found clonus of my lower extremities and her opinion was that this is more than just a vestibular issue. This rehab seemed to help more than anything else I had tried and she recommended I start doing yoga. So I looked up some YouTube videos and made it a daily routine to do yoga. I also began to eat mostly unprocessed foods and am taking 250mg of Magnesium daily. I slowly became less stressed, and my symptoms slowed down enough to where I could get a part time job in January 2019. I got some light sensitivity glasses and went to work. After awhile, I began to feel great, enough so that I got the Front Desk Manager position at my job. Every now and then, if I didn't eat right or I got too stressed, I would get dizzy and confused but it wasn't ever really bad. There was only one day that I had to leave work early. So for months I went with hardly any symptoms. I did a second round of Vestibular Rehab when they did start to pop back up. Before I left my original neurologists office, he was able to refer me to Vanderbilt for a second opinion, MRI, and balance test. My MRI was ""essentially unremarkable."" I have questions about my MRI, because I saw some things that didn't look right to me, but I'm not a radiologist so I'll get a second opinion on that. My balance test showed my left ear was 27% weaker than my right. They talked about the possibility of Meneire's Disease, Multiple Sclerosis, or mini strokes. But it was then concluded that I was ""too young"" for it to be any of these things. I've had just about every blood test you can think of, which have all come back normal. Before I made the trip to Vanderbilt, I would like to note that a lot of the doctor's I was seeing for my issues tried to tell me it was a physical manifestation of my childhood trauma. I know my body. And this is not all in my head and I was enraged, as was my fiancé, when they tried to tell me that's what it was. We recently have moved back to KY, under not the greatest of circumstances. It's been stressful, to say the least. I've been here about a week now and only a few days after arriving, I have begun to have symptoms again, each day getting a little bit worse. It started with just some slight dizziness, then vertigo and nystagmus. My legs have been giving out. Last night the Bell's Palsy thing happened again on my left side, except for this time, the top of my left arm and leg are both numb. I had issues pulling my thoughts together and speaking, which seems to have resolved for the most part today, but I am still getting dizziness, vertigo, and hot flashes/cold chills. My vision in my left eye is now worse than that of my right eye, which has a prescription. Before I conclude this, I will throw out there that my father has been experiencing similar symptoms for years now and he has yet to get a diagnosis because of his lack of insurance and money. My aunt has Multiple Sclerosis and wants me to look into that possibility. I do not want to be one of those cases that takes 17 years to diagnose, when it's to the point of no return. I have two young children I am wanting to homeschool, but if I ""relapse"", for lack of a better word, it won't be an option. I have probably left bits and pieces out, but it has been a long journey and an abundance of chaos."	undiagnosed
PLEASE HELP ME!! UNDIAGNOSED PAIN CONTINUING TO GO OVERLOOKED!!	I first experienced this pain when I was 16 years old. I was at the time on my period and I brushed it off as terrible cramps. It felt like the worst cramping/stabbing/sharp pain I've ever felt in my life, it was so severe it brought me to my knees and took my breath away. I didnt feel that pain for a couple years and once I was 18, the same pain started coming back. This time it didn't come with my periods. It would hit me as random episodes with absolutely no warning or correlation to anything. It seemed like it happened anywhere from between 8 to 6 months. It was always the same pain, it was so bad it would keep me from doing anything. I have gone to the ER for this 3 or 4 times now and its cost so much money and time. I've had countless doctor's appointments and each time, they come up with nothing. A couple doctors have questioned if it was in my head or not, thinking I might have depression or anxiety that manifested into physical pain. I've never been diagnosed with either and I personally do not think it's a mental problem. Usually these episodes last up to 12-20 hours and then go away. The one I have now, which started Sunday night at 12 am, is still here and its rendered me completely useless. I was asleep and early in the morning I was woken up with how intense the pain got. I could barely get out of bed or stand up straight, I got my mom and she said I was totally gray. My ears started ringing to the point I couldn't hear and I was super nauseous. I went to the ER shortly after I woke up, which was monday, and it was the worst pain I think I've ever experienced. For those of you who know what it's like to have an IUD placed, it feels like the first initial cramp that absolutely shocks you, but goes away after a few seconds. It's that pain, but continuous for over 24 hours now. It hurts so incredibly bad for so long now, I dont know what to do. I can't live like this and I need help. All my bloodwork, ultrasounds, CAT scans, HIDA scans, everything looks normal. The only thing is that for a few months now, my white blood cell count and glucose level has been elevated. Every doctor says I seem totally healthy and they can't find a reason for the pain. The pain initially starts in my stomach, above my belly button and then my uterus starts hurting. At first it's always bareable and then the debilitating pain just hits me. The worst of the pain is centered around my uterus, ovaries, and even my private areas. I can't sit down, I can't spread out, no laying on my stomach to see if it helps. There's nothing to do that takes the pain away even a little bit. Ibuprofen doesnt seem to help, unless it's the extra strong dosage from hospitals. It hurts my bladder/uterus area so incredibly bad when I pee or put any sort of pressure on it. It's never lasted this long and it really is ruining my life. I dont know if I can keep living like this, just waiting for the next episode of severe, sickening pain. I need help from anyone who might know what I'm talking about, or I'm just going to keep wasting money on ER trips that only dull the pain momentarily, followed up by more and more doctor's visits - if I can even last that long before I see if I can just take out my uterus and ovaries. Thank you for reading if you made it this far. I need help.	undiagnosed
Never ending stomache pain	Im posting about my girlfriend of 6 years. Sense she was about 12 shes had episodes of extreme abdominal pain she discribes it as a stabbing pain thats right in the center of her body about where the rib cage ends. Its not a constant pain but when she gets her bouts they can last anywhere from a cple days to weeks to months. When its bad she cant even move or walk ive never in my life seen anyone in such a state. She is now 32 and the doctors and hospitals never have any answers shes seen numerous specialists been on a slew of diff medications and nothing seems to help they removed her gaul bladder maybe 6mnths ago and hasnt had an episode intill just this last friday. Our local er keeps her for a few hours then sends her in in the same state she came saying theres notjing they can do for her all the while shes hasnt even beem able to keep water down and has been in bed in constant pain crying and moaning. I hate to see her in this state and shes at her wits end dealing with it. Thamkyou for everyone who has taken the time to read and i appreciate all input	undiagnosed
