I’ve had a hell of a morning.	I’m a college student and I just spent $2,000 fucking dollars on an endoscopy to see why I’m having constant stomach pains, nausea, and diarrhea. Want to guess the result? Absolutely nothing wrong! No ulcers, no inflammation, not even old healed ulcers. I am 100% fucking HEALTHY. And now, because of that, I’m going to be going to school full time and working at least 20 hours a week. I study engineering, and while some people are good at it, I am not. I have family I like to visit on weekends. That’s not happening. I’m a leader of a club. That’s gotta go away. I’m also married, and that’s not a problem, but my husband has his own undiagnosed issues that look a lot like MS- extreme fatigue and his legs buckle and fail a lot. So I try to help out with him. So basically what I’m saying is a lot of time just went down the drain so I could get this ABSOLUTELY USELESS procedure. I fucking hate my body for this. Anytime something’s wrong, it’s diagnosed healthy and I just deal with it. Fucking great.	undiagnosed
Excessive mucus	Looking for answers. Mucus builds up daily and makes him throw up. It's so bad that he feels like he is choking. He has had this condition since childhood and now an adult it hasn't stopped. He says he has been to the doctor yet no answers. Is there anyone out there that can relate?	undiagnosed
I've had Sjogren's and Lupus symptoms for three years and no one believes me	:(	undiagnosed
Need an answer because I can't take it anymore	I've read that Reddit has helped solve some mysteries. It's been a few years now I started to get this cold feeling in the upper part of my arm when the temperature drops or when I'm an an air conditioned place. It started as a small area in my arm and ever since then it's spread to both my arms, neck, chest and now my face. I have seen about 3 or 4 neurologist's and had tried different medications and nothing seems to help. Two of them have sent me to get an MRI to see if what could be causing this. All of the doctors I've seen either tell me that i should have gotten this when I was little due my my car accident, fibromyalgia or they simply don't know what's wrong with me. I'm up to the point where I can't take it anymore and I just want to know what's going on with me. If anyone knows or could know what is wrong I would greatly appreciate it!	undiagnosed
Neurological issues following getting Flu like symptoms last month	M 22, 5’11” 221 ilbs Non smoker Caucasian Non drug use No alcohol use. June 28th- Current date Hey everyone. Thanks for taking the time to read this. (Positive for band 41 on Western Blot) I have been going through the worst month and a half of my life and it’s putting me in a very bad spot mentally. In the middle of June I found some small black thing 2x the size of a poppy seed maybe. It was 1am, was in bed. And I found it directly underneath my groin. I had to remove it with tweezers. Couldn’t tell what it was but I assume it could’ve been a tick, it also wasn’t moving when I removed it? So skip to a week and a half later. I end up getting really bad flu like symptoms. ( Night Sweats, Fever, Swollen Lymph Nodes, Chills, Weakness, Sore Throat) Urgent care just gave me Amoxicillin and said it was more than likely an upper respiratory. 2 days in on that I had horrible sores throughout my mouth and Thrush (Candida) Few days after that I started getting really bad neurological issues. - Memory Loss - Vertigo - No Depth Perception - Confusion - Cognitive Decline - Feeling like the left side of my head is empty - Bipolar cycling - Some hearing sensitivity - Left ear feels like fuzz always I felt like I was living in a bad fever dream What’s worse is I’m self aware of how horrible this all is. It’s like the entire left side of my head has been filled with molasses. I can’t think straight or logically. I can’t be creative. I don’t feel like myself. I started getting kidney pains and have begun the need to constantly have to urinate. Even my most recent blood work came back saying my kidney function was slightly below my normal amount. And my New Born White Blood Cell Count has been slightly elevated as well. I’ve seen a few different doctors and they all just say because my blood work has come back pretty clean that there’s nothing wrong with me and sent me home. I’ve been to the hospital 2 times. I’m absolutely mortified. The only remaining symptoms are - Memory Loss - Cognitive decline - Numb feeling in head - occasional dizziness. - Hearing issues. - Eye floaters - Feeling worse in the night/ Morning Thank you -Current supplements I’m taking - Paleo Vegan diet - Black Seed Oil (7-27-18)✅ - Colloidal Silver (7-15-18)✅ - B12 (7-15-18)✅ - Lion’s Mane (7-25-18) ✅ - Garlic (7-25-18)✅ - Coconut Oil Pills (7-27-18)✅ - Super Omega 3’s (7-19-18)✅ - Uridine (7-27-18)✅ - Choline (7-27-18) ✅ - Phosphatidyl Serine (7-27-18)✅ - Tulang Honey ✅ - Olive Leaf Extract ✅	undiagnosed
Can anyone help piece together these symptoms?	I’m posting this on behalf of someone else. I’m not a Reddit user, but I’ve found that this is a good outlet for issues of this sort. I also want to be honest in saying that I don’t have the full spectrum of their symptoms/issues, however, I have a good base for asking you all here. I am also being as discreet as possible for certain reasons, but I am more than willing to discuss further through private messaging. They’ve been dealing with these issues for approximately 2 years. In the beginning, they traveled in search of an answer, and came up empty. They’ve progressively gotten worse to where they cannot do much other than small, basic, household tasks. They’re only able to lay in one position due to pain, their stomach is very sensitive to certain foods, and it is painful for them to eat. They’ve lost a great deal of weight and are EXTREMELY underweight. They’re losing hair as well. Bed sores have become a major issue because of their inability to lay in positions other than the one. They are not able to leave the house, and at this point have not been able to for approximately 2 years. It seems to have gotten to a point that this has caused depression and mental issues that are preventing them from wanting to seek any more medical attention, as well as they feel they are too weak and doctors will cause harm if they do seek out more help. I’m scared and worried because my loved ones are not wanting to push them into getting anymore help and are basically trying to make them as comfortable as possible until they die. They are around 40 years old, so this is something that hurts me deeply. They are too young for family to not want to do everything they can to help them. I hope someone can help me, and I hope you aren’t offended by my discreetness as I don’t know the reddit culture very well. This is something that is greatly affecting me personally and I decided to take matters into my own hands since no one else is willing to step up and do so. Again, I’m willing to answer any more personal in depth questions privately (reddit has that right?). Please help!!!	undiagnosed
Unexplainable illness, legs covered in now football sized wounds some 1/4 in. deep that do not heal and get bigger over time, and is slowly spreading to rest of body.	My sister has, for the last several years, had this condition where small wounds, can even be as small as scratching an itch, will get worse over time and not heal, eventually resembling large bumpy red burns, with currently about 70&#37; of her legs covered and just her legs, and just last week now one on her stomach. Presumably, a guess by a doctor, the capillaries are dissolving near the wound, causing less and less blood to get to the area, thus causing the wound to widen and deepen over time. It's a constant battle to keep them from getting infected, and we fear the worst if it ever does. Recently her fingernails have grown weak, they crack and split when trying to manipulate simple things like bending paperclips. She has seen and is currently seeing multiple doctors and for a time a panel of many, all to no avail. All tests come back negative, no parasites or evident viruses at play. Her veins are also very quick to collapse, she now has a port in her chest for easy access to blood for the occasional test. We get a 3' by 3' box of pads and gauze every week to keep the wounds covered. At this point I want to get this ridiculous story out there, but any suggestion at all would definitely be appreciated. Before this I guess it would be hard to impossible to imagine the pain of people with undiagnosable and probably fatal diseases, I can see how it would be so easy to feel forgotten by society with no help coming. Sad affair all around. Keep the spirits up and dreams happy guys!	undiagnosed
Eye Condition - Eyes Swell Shut - Chronic for 7 Years	Hi Reddit, This is my first time making a post. My life has been effectively destroyed by a medical condition that remains undiagnosed. Every few days one or both of my eyes have conjunctivitis (pink eye) symptoms that are so severe that one or both must remain closed after they basically swell shut. This started in 2011 when I found myself with pink eye and went to urgent care. I took some antibiotics and it went away. Over time, it happened more frequently and more violently. I've seen something like 6 or 7 eye doctors, seen ear nose and throat specialists, allergists, specialists that specialize in infectious diseases, surgeons that specialize in tear ducts (thought it was tear duct blockage for a while but apparently that just causes extra tearing) and countless GPs. Symptoms: 1. I start to feel pressure and discomfort in the corners of my eye. 2. Eye feels dry and eye starts to produce a discharge that's colored anywhere from clear to dark brown. The crusty stuff at first. 3. Eyelids start to swell and discomfort accelerates. 4. Discharge starts to go crazy and the only thing that makes the pain manageable is to close the eye entirely. 5. Discharge drains down my face, usually a green-brown color. 6. Pain and pressure start to get really bad and it's difficult to concentrate/sleep/etc. 7. Eyelids swell and the tissue around the area gets really inflamed. 8. Symptoms start to recede and gradually the eye returns to normal. It doesn't appear to be an allergy as I've completely moved from one environment to another, lived without a cat for 6 months, quit smoking for 6 months, slept on a couch in case I was allergic to memory foam, completely changed my diet and then back and a million other things. I'm also on antihistamine nasal spray and eye drops right now just to completely eliminate the possibility (it isn't helping). I've tried antibiotics over the course of entire year whenever I got initial symptoms and it does nothing. Steroids help with the healing process but you can't do that long term and it only helps a little bit. I have to wear mirrored sunglasses all the time because this is horrifying to look at. Anyone have similar experiences or have any ideas? I'm not sure what exactly to cover but I'm having no luck and the next step is to submit myself for some sort of study. Any help is appreciated, thanks!	undiagnosed
Boy 13months, Macrocephaly, Developmental Delay, Muscular Hypotonia & Nothing Else.	Boy 13months, Macrocephaly >3.5std+, Developmental Delay, Muscular Hypotonia & Nothing Else. No reason found for it! No Epilepsy, No Seizures, Array CGH negative, No Metabolic or Muscular Deseases found. Undiagnosed! Here are some pictures of his recent MRI. Apparently nothing found. Can it be PMG or does anyone have any idea what is going on? Worried sick still since 6 months. He started crawling a little at 13months. Can sit up now. Some Pictures of MRI http://imgur.com/5OTn1Cu,RSz1YIY,UhsM5Fu,CtjdIOs	undiagnosed
Undiagnosed for three months.	Hi Im mark. I havehad chronic fatigue ladting three months. Been tk the hospital 6 times and two diff doctors and a urologist My face is beat red. My vision has gotten poorer. An rbti consultant pointed out i had acidosis. Urine ph was 5.5/6.4 was tested for heavy metals because I was in an abusive relationship. My arsenic level was <15 but he didnt test to see organic and inorganic. My appetite is gone. I lost thirty pounds. I dont feel as crappy at night time but still gery crappy. Very tired after 8 hours of sleep and have stomache pain and tinnitus. My legs and arms fall asleep easy. My blood pressure has been 150/100 every time ive been to the hospital. Running out of time I feel like. God bless	undiagnosed
Seen Doctor, ER, and Gastro.... Still No Answers!	Hi, I'm Austin! Since June 20th 2016 I have been waking up every morning between 5 and 7 am writhing in pain and needing to run to the restroom. When I use the restroom it is usually an hour or two of hot lava spewing from my back end. In the beginning I threw up a lot but that has mostly subsided. After using the restroom, my stomach just hurts, feels bloated, gassy, and cramped. I have very little appetite, but once I do eat I fill up immediately. Then it is just a continuation of the stomach ache until morning where I repeat that schedule. What has been done so far: Gastric Emptying, stool sample, blood sample, CT scan, CT scan with iodine, gallstone ultrasound, endoscopy, colonoscopy, and I have a HIDA scan scheduled for next Friday, also waiting on the results of a food sensitivity blood test. Medications I am on: Zoloft, Xanax (only taken when travelling), dyciclomine, dexilant, vitamin d pills, IBguard / FDguard, and promethazine. Medications I have taken: everything above, xifaxan, assorted pro biotics, assorted anti biotics. Final notes: Things tend to be the worst in the mornings, I have tried cutting out certain foods, and am seeing a chiropractor weekly.	undiagnosed
Seen Over a Dozen Doctors and No Diagnosis Yet	"I've been poked and prodded, and scanned over the past 7 years, and still no diagnosis. I've completely lost trust in the competency of most doctors because of the unscientific way that most of them approach problems that they can't affix a quick label to and prescribe a pill for. My family, though for the most part is supportive, still makes frustrating and dismissive suggestions about what I need to do for my health. ""Oh, have you seen a naturopath?"" ""Maybe you're sensitive to gluten?"" ""I read this thing in this book, and it probably is migraines""... The list goes on and on. My husband thinks I'm being lazy when I don't want to go out because I'm so fatigued. Symptoms like numbness, weakness, confusion, and other vague and fleeting sensations just don't elicit the sympathy and understanding that a tummy ache or fever does, even though they can by symptoms of serious diseases. I am lucky to have great medical care now, and am gradually getting closer to a diagnosis. There are a lot of objective tests that still need to be done. I'm convinced now that this is not an unsolvable mystery, just doctors rely too much on subjective diagnostic criteria. I have lumps under my skin that need to be examined, and probably biopsied. I had a high white blood cell count in my spinal fluid several years ago. They need to do another lumbar puncture. There are still blood tests for certain cancers, and autoimmune disorders that they can do. I don't have MS, migraines, lupus, gluten intolerance, or a thyroid deficiency. These are things that have been tested for. What me and doctors are still going to look at is: Sjogrens, lymphoma, paraneoplastic syndrome, and the cancers that could cause it, sarcoidosis.. Sorry about my disorganized rant!"	undiagnosed
It's been 10 years for me.	I just wanted to say a few things. I'm glad Reddit has an undiagnosed subreddit, but I wish it was stronger. More posts, more users, etc. I have been on this trainwreck of a stumbling, fumbling journey for 10 long years. My disease has left me unable to work, despite my best efforts, and my state chose not to expand Medicaid. Clinics only help with the basics, and I don't qualify for charity programs. And a doctor has to submit each case to the Undiagnosed Diseases Program, and a doctor has to request genetic sequencing. There are very few reduced-cost copay programs, and I either don't qualify for them, or I have stumped the doctors there. So I don't qualify for any kind of health insurance. I can't get a diagnosis, because I can't get help. And I can't get help, because I don't have a diagnosis. This issue has nearly left me homeless. I've already done CrowdMed, and I've already emailed talk show hosts, started a GoFundMe campaign, emailed the White House and my governor, called every clinic in my state, tried to get a lawyer, all of it. And CrowdMed was the only thing that was helpful. Unfortunately, you have to get your CrowdMed diagnostic suggestion confirmed with a physician in person. Which I can't afford. So I'm still undiagnosed. Along the way, as I have dragged my carcass through this journey, I like to at least think that I have learned what works and what doesn't. I have had journalists publish articles about me, and I have published articles about my experience as well. But it doesn't do any good. Doctors either refuse to listen or refuse to help. Right now, I am going to a local reduced-copay doctor's office. He is wiling to conduct any test I need, but this doctor's office will be paying for it all out of pocket. They can't blow the entire budget on one patient, so they are limited. I am thinking about getting some blood tests from the University of Washington's Collagen Diagnostics Lab, (skin biopsy, TAAD panel, NSG panel) having UW bill me, then apply for UW's financial assistance program. I haven't had an income since 2008, so it should be a shoe-in. My next appointment is not until September 24th, and I am stuck just biding my time until then. Such is the never-ending struggling just to find out what's killing me. I have dedicated everything I have to trying to help myself, since no one else will. I have done all my own research, called, emailed, chased new leads, and followed up, all on my own. All while everyone around me constantly chastised me, minimized my illness, and told me I was just being lazy. All while trying to avoid homelessness. Thus concludes my rant for the day.	undiagnosed
